{
  "n_pert": 1135,
  "n_edge": 2274000,
  "no_effect_base_rate": 0.8050413368513633,
  "primary_delta": 0.25,
  "acc": {
    "STATE": [
      0.7317198768689533,
      0.727536416653452,
      0.7356555286343612
    ],
    "no_change": [
      0.8050413368513633,
      0.8003466280865095,
      0.8093780506607929
    ],
    "mean": [
      0.4537207563764292,
      0.45177338136614065,
      0.45572787956365585
    ]
  },
  "auroc": {
    "STATE": [
      0.43910263395305027,
      0.43566908955937034,
      0.4427478524249961
    ],
    "no_change": [
      0.5,
      null,
      null
    ],
    "mean": [
      0.4227559890712731,
      0.41965903903285123,
      0.4259385709119868
    ],
    "|real|_oracle_ceiling": [
      0.5774822958917598,
      0.573382063722347,
      0.5818813750005193
    ]
  },
  "pds": {
    "STATE": 0.7928924939203941,
    "mean": 0.5
  }
}
